{
  "id": "date-picker",
  "label": "DatePicker",
  "status": "implemented",
  "props": [
    {
      "name": "className",
      "kind": "string",
      "required": false
    },
    {
      "name": "defaultValue",
      "kind": "string",
      "required": false
    },
    {
      "name": "disabled",
      "kind": "boolean",
      "required": false,
      "native": true
    },
    {
      "name": "error",
      "kind": "string",
      "required": false
    },
    {
      "name": "fullWidth",
      "kind": "boolean",
      "required": false
    },
    {
      "name": "helperText",
      "kind": "string",
      "required": false
    },
    {
      "name": "id",
      "kind": "string",
      "required": false
    },
    {
      "name": "label",
      "kind": "node",
      "required": false
    },
    {
      "name": "locale",
      "kind": "string",
      "required": false
    },
    {
      "name": "maxDate",
      "kind": "string",
      "required": false
    },
    {
      "name": "minDate",
      "kind": "string",
      "required": false
    },
    {
      "name": "open",
      "kind": "boolean",
      "required": false
    },
    {
      "name": "placeholder",
      "kind": "string",
      "required": false
    },
    {
      "name": "readOnly",
      "kind": "boolean",
      "required": false
    },
    {
      "name": "required",
      "kind": "boolean",
      "required": false
    },
    {
      "name": "size",
      "kind": "unknown",
      "required": false
    },
    {
      "name": "value",
      "kind": "string",
      "required": false
    },
    {
      "name": "variant",
      "kind": "unknown",
      "required": false
    },
    {
      "name": "weekStartsOn",
      "kind": "unknown",
      "required": false,
      "default": 0
    }
  ],
  "states": [
    "default",
    "disabled",
    "open",
    "error"
  ],
  "accessibility": [
    {
      "id": "documented",
      "rule": "Public DatePicker accessibility is covered by component implementation and stories."
    }
  ],
  "notes": [
    "Events are framework-specific and omitted from this contract.",
    "Synced from packages/ui-react DatePickerProps (engineering-first)."
  ]
}
