{
  "id": "divider",
  "label": "Divider",
  "status": "implemented",
  "props": [
    {
      "name": "children",
      "kind": "node",
      "required": false,
      "native": true
    },
    {
      "name": "flexItem",
      "kind": "boolean",
      "required": false,
      "default": false
    },
    {
      "name": "fullWidth",
      "kind": "boolean",
      "required": false,
      "default": false
    },
    {
      "name": "orientation",
      "kind": "unknown",
      "required": false,
      "default": "horizontal"
    },
    {
      "name": "semantic",
      "kind": "boolean",
      "required": false,
      "default": false
    },
    {
      "name": "textAlign",
      "kind": "unknown",
      "required": false,
      "default": "center"
    }
  ],
  "states": [
    "default"
  ],
  "accessibility": [
    {
      "id": "documented",
      "rule": "Public Divider accessibility is covered by component implementation and stories."
    }
  ],
  "notes": [
    "Events are framework-specific and omitted from this contract.",
    "Synced from packages/ui-react DividerProps (engineering-first)."
  ]
}
