{
  "id": "drawer",
  "label": "Drawer",
  "status": "implemented",
  "props": [
    {
      "name": "children",
      "kind": "node",
      "required": false
    },
    {
      "name": "container",
      "kind": "unknown",
      "required": false,
      "description": "Portal mount target; defaults to document.body."
    },
    {
      "name": "defaultOpen",
      "kind": "boolean",
      "required": false,
      "default": false
    },
    {
      "name": "dismissOnBackdrop",
      "kind": "boolean",
      "required": false,
      "default": true
    },
    {
      "name": "dismissOnEscape",
      "kind": "boolean",
      "required": false,
      "default": true
    },
    {
      "name": "open",
      "kind": "boolean",
      "required": false,
      "description": "Controlled open state."
    },
    {
      "name": "showClose",
      "kind": "boolean",
      "required": false,
      "default": true
    },
    {
      "name": "side",
      "kind": "enum",
      "values": ["left", "right", "top", "bottom"],
      "required": true
    },
    {
      "name": "size",
      "kind": "enum",
      "values": ["sm", "md", "lg"],
      "required": false,
      "default": "md"
    },
    {
      "name": "transition",
      "kind": "unknown",
      "required": false,
      "description": "Enter and exit animation durations in milliseconds."
    }
  ],
  "states": ["default", "open", "focus"],
  "accessibility": [
    {
      "id": "dialog-role",
      "rule": "Expose dialog semantics (role=dialog, aria-modal) on the drawer surface."
    },
    {
      "id": "labelled",
      "rule": "Associate a title/description for accessible naming."
    }
  ],
  "notes": [
    "Events (onClose, onOpenChange, onBackdropClick, onEscapeKeyDown) are framework-specific and omitted.",
    "Drawer renders its portal, overlay, and dialog surface internally."
  ]
}
