{
  "id": "data-table",
  "label": "DataTable",
  "status": "implemented",
  "props": [
    {
      "name": "defaultPage",
      "kind": "number",
      "required": false,
      "default": 1
    },
    {
      "name": "defaultPageSize",
      "kind": "number",
      "required": false
    }
  ],
  "states": [
    "default",
    "focus",
    "disabled",
    "open",
    "error"
  ],
  "accessibility": [
    {
      "id": "documented",
      "rule": "Public DataTable accessibility is covered by component implementation and stories."
    }
  ],
  "notes": [
    "Events are framework-specific and omitted from this contract.",
    "Synced from packages/ui-react DataTableProps (engineering-first)."
  ]
}
